,,
"Imagine an angel, beautiful, bewitching, magical, China's Thousand-handed Avalokitesvara, Thousand-handed Avalokitesvara, super-detailed face, super-detailed , lotus base, dark green lotus floating, adventure, mirror, glass, magic circle, magic circle, fantasy, fog, light, flame, crystal, gold, green, nebula, surreal, unreal angel, beautiful, magical, Valkyrie, , magical. Mirror, Glass, Magic Circle, Might and Magic, Fantasy, Mist, Fluorescent, Crystal, Black, Nebula, Surreal, Unreal Engine HD --ar 9:16",,
"Imagine Angel, Beautiful, Magical, Goddess Wu, Red Lotus, Fire Element Red Lotus, Adventure, Mirror, Glass, Magic Array, Magic Array, Fantasy, Mist, Light, Crystal, Gold , Fire, Fire Element, Burning, Red, Red Light, Nebula, Surreal, Unreal Angel, Beautiful, Magical, Valkyrie, Intermediate, Magical. Mirror, Glass, Magic Circle, Might and Magic, Fantasy, Mist, Fluorescent, Crystal, Black, Nebula, Surreal, Unreal Engine HD --ar 9:16",,
"Imagine Angel, Beautiful, Magical, Goddess Wu, Red Lotus, Fire Element Red Lotus, Adventure, Mirror, Glass, Magic Array, Magic Array, Fantasy, Mist, Light, Crystal, Gold , Fire, Fire Element, Burning, Red, Red Light, Nebula, Surreal, Unreal Angel, Beautiful, Magical, Valkyrie, Intermediate, Magical. Mirror, Glass, Magic Circle, Might and Magic, Fantasy, Mist, Fluorescent, Crystal, Black, Nebula, Surreal, Unreal Engine HD --ar 9:16",,
"It is a beautiful picture. There are many huge blue roses floating in the deep sea, the brightness of the moon, magic clouds, several sailboats, giant sailboats, Klein Blue Dream rendering, surreal, surreal, super beautiful dream, HD,beautiful ethereal fairyland--HD --ar 9:16",,
" Through high definition CG, green big lotus in light green fire, Lightning,Light Effects, 8K, Ultra HD, Blizzard style art trends,Luminous fog luminous ，volume lightVolumetric light --ar 9:16",,
"Glittering blue flaming lotus flower, floating and burning on water, symmetry, self-illumination, virtual engine, 8K, chaos --ar 9:16",,
"Through high definition CG, golden big lotus in light golden fire, Lightning,Light Effects, 8K, Ultra HD, Blizzard style art trends,Luminous fog luminous ，volume lightVolumetric light --ar 9:16",,
"The lavender French sports car is parked at the romantic lavender flower seaside, and there are several roses on the sports car. The sea of flowers sparkled. The color is gorgeous. Star aurora appears in the sky, fairy tale world, fantasy, 8K, ，volume lightVolumetric light visible fluoresce hyperrealism photograph --ar 9:16 --iw 10",,
" Paleo landscape, beautiful paleoart, high grass, ferns, open plains, intricate detail, beautiful lighting, Brian engh, Albert bierstadt, peaceful, small river, idyllic, An Jung-hwan --ar 2:3 --test --creative --upbeta",,
"Top view, massive scale, animation concept art, Breath of the wilde, European photography, studio ghibli style, Clear reflection, A Luxury Monumental Futuristic building in art Nouveau Architecture, epic Plaza pool, 1.5 Crystal clear, sun rays:1.5 miyazaki, Craig Mullins dappled lighting, octane render, cinematic, photographic, realistic, highly detailed --w 1200 --h 2400 --no human --test --creative --upbeta",,
"Christmas village, illuminating light rays, in the style of Thomas Kinkade, matte painting, photorealistic, highly detailed, hd, hdr, uhd, unreal engine 5, 8k --ar 5:7 --test --upbeta --upbeta",,
 A Dandelion made of White crystal，Blue sky，epic，Art on Instagram，concept art，digital painting，3d，style of Psychedelia art，8K，hyperdetailed，render --ar 10:14 --test --creative --upbeta,,
"Elevation, Breath of the wilde, sun rays, 1.2 emil melmoth, 0.1 studio ghibli style, Epic red Torii Gate, The ground was flooded with a layer of shallow water, 1 tight temples alley in town of Kyoto, lush vegetation and flowers, white drogan, 0.1 dappled lighting, cinematic, photographic, realistic, highly detailed, matte painting --w 1200 --h 3000 --test --creative --upbeta",,
"beautiful fairytale landscape, 8k hyper detailed —ar 2:3 --upbeta --testp --upbeta",,
"hyperdetailed oasis with saguaro cacti and flowers emerging from ground of hyperdetailed fantasy desert that with a stream flowing through it that glows like the sunset, cinematic lighting, 8k, unreal engine, octane render, realistic --ar 16:24 --test --creative --upbeta --upbeta",,
silence lonely tree pine see water blue soft mist blue hour autumn photorealistic photography fine-art nature Finland Northern,,
"@The beach near is covered with colorful and luminous stones, and in the distance there are lighthouses + lights, fluorescent oceans, moonlight, and shining stars,, 3d, Ultra-wide viewing angle, Aerial view, Moonlight shines on a sea of twinkling stars, Reflection, featured on cg society, Volumetric light, space art, bioluminescence, unreal engine 5, Magic of light, rendered in unreal engine, Ultra-wide viewing angle, Aerial view, Ultra-wide viewing angle, 8k,8K --ar 9:16",,
"distant galaxies, matte painting. You can feel its loyalty and purity in the context of love. Light Blue View Photography by MakamosHD --ar 9:16",,
"fantasy christmas village, snowing, illuminating light rays, photorealistic, highly detailed, hd, hdr, uhd, unreal engine 5, 8k --ar 2:3 --test --s 5000 --upbeta",,
"fantasy christmas village, big christmas tree, presents, reindeers, elfs, snowing, illuminating light rays, photorealistic, highly detailed, hd, hdr, uhd, unreal engine 5, 8k --ar 2:3 --test --s 5000 --upbeta",,
"Through high definition CG,Red Rose in Fire, Lightning,Light Effects, 8K, Ultra HD, Blizzard style art trends,Luminous fog luminous volume lighting，HD --ar 9:16",,
"the king of all peonies feathers, peony flower petals kinsugi porcelain, blue and white, norimichi, Romain lenancker, zen, gold filaments, nacre, wabi sabi, black background, sam kaplan, goulko, cinematic light, soft shadows, flamingo, gold feathers, color background, hyper detailed, volumetric lighting,made of apricot , butterfly essence, insanely detailed and intricate, hypermaximalist, elegant, ornate, hyper realistic, super crowded, dense, 8k, an astronaut helmet full of flowers, rococo painting by Francois Boucher and Mandy Jurgens and Pino Daeni and Alfonso Mucha, mystical, classical sci-fi, beautiful, soft studio lighting, octane render, hyper detailed, volumetric lighting, global illumination, detailed and intricate environment, 8k, --ar 9:16  --test --creative --upbeta --upbeta",,
"Golden Lake under the starry sky, with huge transparent golden ice cubes, ice caves, yellow aurora, blue sky, shining stars, CG rendering, space art, bioluminescence, unreal engine 2, super wide angle, high definition, volume light, volume light. Co-created by Mark Addums and Vincent Favre  HD --ar 9:16",,
"Imagine Angel, Beautiful, Magical, Goddess Wu, Red Lotus, Fire Element Red Lotus, Adventure, Mirror, Glass, Magic Array, Magic Array, Fantasy, Mist, Light, Crystal, Gold , Fire, Fire Element, Burning, Red, Red Light, Nebula, Surreal, Unreal Angel, Beautiful, Magical, Valkyrie, Intermediate, Magical. Mirror, Glass, Magic Circle, Might and Magic, Fantasy, Mist, Fluorescent, Crystal, Black, Nebula, Surreal, Unreal Engine HD --ar 9:16",,
"Imagine angel, beautiful, magical, goddess Wu, red lotus, adventure, mirror, glass, magic circle, magic circle, fantasy, mist, light, crystal, gold, fire, burning, Red, Red Light, Nebula, Surreal, Unreal Angel, Beautiful, Magical, Valkyrie, Intermediate, Magical. Mirror, Glass, Magic Circle, Might and Magic, Fantasy, Mist, Fluorescent, Crystal, Black, Nebula, Surreal, Unreal Engine HD --ar 9:16",,
"Imagine Angel, Beautiful, Magical, Goddess Wu, Red Lotus, Burning Fire, Red Water Element, Adventure, Mirror, Glass, Magic Array, Magic Array, Fantasy, Fog, Light, Crystal, Gold, Nebula, Surreal, Unreal Angel, Beautiful, Magical, Valkyrie, Medium, Magical. Mirror, Glass, Magic Circle, Magic Gate, Fantasy, Mist, Fluorescent, Crystal, Black, Nebula, Surreal, Unreal Engine, HD --ar 9:16",,
"Imagine angel, beautiful, magical, goddess Wu, adventure, mirror, glass, magic circle, magic circle, fantasy, mist, light, crystal, gold, nebula, surreal, illusory angel, beautiful, magical, goddess Wu, in the middle, magical. Mirror, Glass, Magic Circle, Magic Gate, Fantasy, Mist, Fluorescence, Crystal, Black, Nebula, Surreal, unreal engine，HD --ar 9:16",,
"Imagine angel, beautiful, magical, goddess Wu, adventure, mirror, glass, magic circle, magic circle, fantasy, mist, light, crystal, gold, nebula, surreal, illusory angel, beautiful, magical, goddess Wu, in the middle, magical. Mirror, Glass, Magic Circle, Magic Gate, Fantasy, Mist, Fluorescence, Crystal, Black, Nebula, Surreal, unreal engine，HD --ar 9:16",,
"Imagine angel, beautiful, magical, goddess Wu, adventure, mirror, glass, magic circle, magic circle, fantasy, mist, light, crystal, gold, nebula, surreal, illusory angel, beautiful, magical, goddess Wu, in the middle, magical. Mirror, Glass, Magic Circle, Magic Gate, Fantasy, Mist, Fluorescence, Crystal, Black, Nebula, Surreal, unreal engine，HD --ar 9:16",,
"Imagine an angel, beautiful, magical, adventure, Mirror, glass, magic, magic, magic, Fantasy, Mist, light, Crystal, gold, nebula, surreal, Imaginary Angel, beautiful, magical, Angel, in the middle, amazing. Mirror, glass, Magic Circle, magic door, Fantasy, Mist, fluorescence, Crystal, pink, nebula, surreal, fantasy engine, HD --ar 9:16",,
"Imagine angel, beautiful, magical, goddess Wu, adventure, mirror, glass, magic circle, magic circle, fantasy, mist, light, crystal, gold, nebula, surreal, illusory angel, beautiful, magical, goddess Wu, in the middle, magical. Mirror, Glass, Magic Circle, Magic Gate, Fantasy, Mist, Fluorescence, Crystal, Black, Nebula, Surreal, unreal engine，HD --ar 9:16",,
"imagine angel, beautiful, magical, goddess Wu, white lotus, adventure, mirror, glass, magic circle, magic circle, fantasy, mist, light, crystal, gold, nebula, surreal , Unreal Angel, Beautiful, Magical, Wu Goddess, Middle, Magical. Mirror, Glass, Magic Circle, Might and Magic, Fantasy, Mist, Fluorescent, Crystal, Black, Nebula, Surreal, Unreal Engine HD --ar 9:16",,
"Imagine an angel, beautiful, magical, adventure, Mirror, glass, magic, magic, magic, Fantasy, Mist, light, Crystal, gold, nebula, surreal, Imaginary Angel, beautiful, magical, Angel, in the middle, amazing. Mirror, glass, Magic Circle, magic door, Fantasy, Mist, fluorescence, Crystal, pink, nebula, surreal, fantasy engine, HD --ar 9:16",,
" Imagine an angel, beautiful, magical, adventure, crushed ice, mirror, glass, Magic Circle, Magic Circle, Fantasy, Mist, light, Amethyst, fire, Nebula, surreal, imagine an angel, beautiful, magical, fantasy Angel, in the middle, magical. Mirror, glass, Magic Circle, magic door, Fantasy, Mist, fluorescence, Crystal, black, nebula, surreal, fantasy engine，HD --ar 9:16",,
" Imagine angel, beautiful, magical, goddess Wu, adventure, mirror, glass, magic circle, magic circle, fantasy, mist, light, crystal, gold, nebula, surreal, illusory angel, beautiful, magical, goddess Wu, in the middle, magical. Mirror, Glass, Magic Circle, Magic Gate, Fantasy, Mist, Fluorescence, Crystal, Black, Nebula, Surreal, unreal engine，HD --ar 9:16",,
" Imagine angels, beautiful women, magic, goddess of luck, adventure, glass, diamonds, magic world, fantasy, colorful wings, fog, light, crystal, gold, nebula, surrealism, imagine angels, beauty, magic, goddess of freedom, in the middle, magic. Mirror, glass, golden wings, magic stick, magic corolla, fantasy, fog, diamond, fluorescence, crystal, black, nebula, surreal, virtual engine, 8K, 16K HD, 50 million cameras, super wide angle, overlooking, decorative lines, cloud sea, 3D lighting, sky, dream, fairy tale, author: shallow ink，HD --ar 9:16",,
"Imagine the lotus angel, in the heart of the flower, bit by bit to present it beautiful, magic, witch goddess, adventure, mirror, glass, magic circle, magic circle, fantasy, fog, light, crystal, gold, nebula, surreal, unreal angel, beautiful, magic, witch goddess, middle, magic. Mirrors, glass, magic circles, Might and Magic Doors Fantasy, Mist, Fluorescence, Crystal, Black, Nebula, Surreal, unreal engine，HD --ar 9:16",,
"Through high definition CG, black big lotus in light white fire, Lightning,Light Effects, 8K, Ultra HD, Blizzard style art trends,Luminous fog luminous ，volume lightVolumetric light --ar 9:16",,
"Through high definition CG, golden big lotus in light golden fire, Lightning,Light Effects, 8K, Ultra HD, Blizzard style art trends,Luminous fog luminous ，volume lightVolumetric light --ar 9:16",,
"Through high definition CG, black big lotus in light red fire, Lightning,Light Effects, 8K, Ultra HD, Blizzard style art trends,Luminous fog luminous ，volume lightVolumetric light --ar 9:16",,
"Through high-definition CG, purple lotus, light purple flame, lightning, lighting effect, 8K, ultra-high definition, blizzard style art trend, luminous fog luminescence, volume lightVolumetric light --ar 9:16",,
"A green lotus flame , with a huge green lotus on it , diamond starlight on it , and a huge golden Chinese angel dragon flame propagation lamp below , HD --ar 9:16",,
"Through high-definition CG, black lotus blooms on lightning, golden lightning, light effect, 8K, ultra-high-definition, blizzard-style art trend, luminous fog and luminous volume lighting,Volumetric light --ar 9:16 --test --creative --upbeta",,
"Nature photography, sunrise, lake with water and ice and snow, rocky shoreline with some snow, large pine trees, craggy snow covered mountain range in the distance, photograph, cinematic lighting --ar 2:3 --testp --creative --no signature ",,
"There is a kind of rose, which is light blue. Petals as deep as sea water, crystal clear as dew. There are many green leaves on the flower branches, and many crystal white roses. It can feel the loyalty and purity of love, high-definition, high-quality, realistic photos, high details, 8k. --ar 9:16",,其他颜色玫瑰自己可以改关键词颜色
"The sky is full of orange flaming clouds. The reflection is in the lake. There are trees on both sides of the lake shore. Super wide-angle reflection, reflection, physical light,8k high detail, high-definition pictures --ar 9:16",,
"This is surreal and sophisticated CG rendering. At night, the light blue sky is covered with the great waterfall on the golden river, purple heart-shaped crystal, luminous path, rose moon, starlight, art, HD, starry sky, many small and colorful luminous particles, composed of the Milky way, the north pole, tundra and iceberg, fantasy, high detail, beauty, 8K, octane lamp and shadow, complex detail, ultra wide angle, panoramic shooting, 8K. High definition. Landscape photography by Marc ADAMUS, real photo volume light, 8Kv volume light HD, --ar 9:16",,
"At night, a fantastic rainbow covers the beach, on the beach there are many colorful roses and glowing crystal pebbles, fantasy, cinematic epic effects, refinement,ultra-wide field of view, CG rendering, detail, HD, realism, 3D, ultra-detail, realism, 8K, masterpiece, functional art,ultra-wide angle --ar 9:16",,
"Through high definition CG, Lycoris recoil, Japanese animation, multiple exposure, Starscream Chrysanthemum,Ultra HD, petal crystal clear, dewdrop crystal clear , hyper-detail, long exposure, dramatic light, 8K ,HD --ar 9:16",,
"This is a surreal and complex CG rendering. At night, the light blue sky as transparent as a mirror, crescent water, moonlight, starlight, trees, shining Milky Way, art, HD, starry sky, glaciers, many huge blue rose glacier, surreal blue rose, and many small and colorful luminous particles, dream, HD complex details, beauty, 4K, aurora, octane light and shadows, complex details, ultra wide angle, panoramic photography. Virtual engine, volume lights, reflected light, light effects.three-dimensional.16KHD --ar 9:16",,
"There is a kind of rose. It is yellow. The petals are as deep as sea water and crystal clear as dew. There are many green leaves on the flower branches, as well as many crystal clear white roses. It can feel the loyalty and purity of love, high-definition, high-quality, realistic photos, high details, HD --ar 9:16",,
"a lake at night surrounded by the woods, galaxies in the sky reflecting in the water, unreal engine, ultra realistic, intricately detailed, colorful --ar 9:16",,
"This beautiful tree branch , mild fog, with white and fuchsia flowers, plum blossoms, mountain valley,high definition, dream fairy kingdom HD --ar 9:16",,
"The red sky is like a flame with a huge shape of love. Golden rose, sparkling lake stars, sparkling, true HD, super wide-angle panorama, super HD, 8k lifelike, high pixel, cracked, Mark Addums landscape photography,HD --ar 9:16",,
"T color aurora in white snow,cars,trains,pelple,houses,villages,stalls,snow mountains,rivers and snowstorms,fireworks in the world,colouful stars twinking,illusory engines,4khigh-definition.8K,HD --ar 9:16",,
"This is a beautiful picture, depicting a tourist attraction, a white snow mountain, tourists, a light green subway, a 4K medium shot, and bright stars as charming as diamonds. The beautiful ski resort is covered with snow. Bright, lively, noisy, bright, starlight flash, 18K dream engine, HD wallpaper, new chapter rendering, night and night HD, HD hard disk ，HD --ar 9:16",,
"Rose red shore flower,Lycoris recoil, Japanese animation, multiple exposure, Starscream 8k --ar 9:16",,
"Golden dream starry sky, ice lake, real shot, crack,real, realistic, 8K, ultra wide angle, panorama, 3D,Ultra HD, high pixel,HD --ar 9:16",,
"At night, starlight shines in lake,Blue sky like angel wings, lake, real high-definition, super wide angle panorama, super high-definition, 8k lifelike, high pixel, crack,landscape photography by Marc Adamus,HD --ar 9:16",,
"This is a surreal and complex CG rendering. At night, the light blue sky as transparent as a mirror, crescent water, moonlight, starlight, trees, shining Milky Way, art, HD, starry sky, glaciers, many huge blue rose glacier, surreal blue rose, and many small and colorful luminous particles, dream, HD complex details, beauty, 4K, aurora, octane light and shadows, complex details, ultra wide angle, panoramic photography. Virtual engine, volume lights, reflected light, light effects.three-dimensional.16KHD --ar 9:16",,
"The sky, Uyuni salt marsh, and the wonders of salt tundra，light, super healing, ultra-high definition, 8k, panorama, super wide angle, live shot, real, realistic, high pixel, very beautiful, super detail, rendering, senior master filter,Thomas KincaidIvan EvazovskyAn epic CGlandscape photography by Marc AdamusHD",,
"At night, there are many shooting stars reflected in the sky on the heart-shaped ice lake, rainbow, blue, laser wings, floating luminous particles, aurora, fairy light,body light,body light,luminous creatures, stellar luminous particles, soft light, surreal, modern style, art, dream engine, ultra wide angle perspective,hin renderingHD --ar 9:16",,
"There is an ice rose, which is orange. The petals are as deep as sea water, crystal clear, crystal clear as dew. There are many green leaves on the flower branches, as well as many translucent orange roses. It can feel the loyalty and purity of love, high-definition, high-quality, realistic photos, high details, 8k, super details，HD --ar 9:16",,
"At night, the beautiful valley, the Milky Way, the moon, the golden rose streaming with stars, stars, luminous particles, meteors, magical clouds, mysterious dreams, stars falling, soft light, real picture, lucky digital rendering HD --ar            9:16",,
"Frozen, Frozen Princess back, Mirror like lake surface，crescent moon rendering, transparent moon rendering, mirror effect, high fidelity, light tone, romantic atmosphere, moon mirror rendering, Dawn in the flower sky, lighting, moon, 4K, --ar 9:16",,
"A real rose with green leaves on the branch, velvety black rose, velvety black rose with black crystal dew, light black blurred background and clear layers, octane rendering, Pixar movie 3D animation, 8k, volumetric light --ar 9:16",,
"Lycoris, Japanese animation, Multiple exposure, Blue Spider Chrysanthemum, Tokyo Forest, Ultra detail, Long exposure, Dramatic light, 8K, HD-HD --ar 9:16",,
"A ultra-realistic CG rendering of Ancient China,超高清，超现实，There is a stream, jiangnan ancient buildings on besides of thet streamin the evening,Maple with milky leaves treesnow scene, a moon in the sky,HD --ar 9:16",,
"At night, the Milky Way, starlight, and silvery new moon are sprinkled on the beach along with the Milky Way starlight. On the beach, there are pink roses, many luminous creatures, coconut trees, and the beach is the shape of love, pebbles, luminous creatures, fluorescence, gold, color, dream, super wide-angle light, unreal engine, 4K HD,HD --ar 9:16",,
"An epic CG matte painting with two wishing people, sitting on a hillside, green grass, on a summer night with light blue stars, fireflies, it was painted by fashion art station Evgeny Lushpin, very detailed, depicting details, dream, 128k resolution --ar 9:16",,
"Lycoris recoil, Japanese animation, multiple exposure, Green petals， Chrysanthemum, Tokyo Forest, hyper-detail, long exposure, dramatic light, 8K ,HD --ar 9:16",,
"HOne kind of flower is purple. Its petals are as deep as the sea, and its heart is like dew. There are many green leaves on the branches, and many sparkling Purple Button bell orchids. Compared with love, you can feel its loyalty and purity.D --ar 9:16",,
"The picture is transparent. A huge silver-white crescent moon is scattered on the beach. The Milky Way shines with many purple-blue roses. There are many purple-blue rose flowers on the beach, fantasy, highly detailed, beautiful, 8k, octane rendering, real photos, complex details, ultra-wide viewing angle, panoramic shooting, and several purple-blue roses in the foreground. Duo HD --ar 9:16",,
"This is a beautiful picture. There are many huge blue roses floating in the deep sea, moonlight, magical clouds, several pirate ships, Klein blue dream rendering, surreal, surreal, super dream, high definition, beautiful ethereal wonderland high definition --ar  9:16",,
"Blue Dream Starry Sky, Ice Lake, Real Shooting, There is a huge love shape on the ice lake, real, realistic, 8K, ultra-wide angle, panoramic, 3D, ultra HD, high pixels,  HD --ar 9:16",,
"This beautiful branch, mist, white and red flowers, plum blossom笔触,花朵高清，超高清，花瓣，在空中飞舞，海天一色 plum blossom branch, HD, dream, HD --ar 9:16",,
"Upscaling image #4 with Super wide angle view,在云上的桥,樱花,月亮,叶子，4k  --ar 9:16 ",,
"At night sky, the beach is covered with blue and green fluorescence, the huge moon, elf light, stars, facula,coconut tree， the sea with fluorescence, the shining golden beach, the starry sky with moonlight, Michael james Smith's matte painting, golden，reflection, cg rendering, volume light, space art, bioluminescence, unreal engine 5, magic of light, unreal engine rendering, super wide angle, super wide angle, high definition. --ar 9:16 ",,
"Blue ocean, blue starry sky at night, stars twinkling in the sky, white sand beach in Maldives, many pink roses of different sizes on the beach, blue roses, many tiny and colorful luminous particles illuminate the Milky Way, the Arctic, the tundra and icebergs, fantasy, high detail, beauty, 8K, octane shadow, complex details, close-up, close-up、 8k、HD  --ar  9:16  --q 2 ",,
"This is surreal and exquisite CG rendering. At night, the pale blue sky, glaciers covering the beach, purple heart-shaped stones, glowing paths, roses, the moon, starlight, art, high definition, starry sky, many tiny and colorful luminous particles, illuminated by the Milky Way, the Arctic, tundra and icebergs, fantasy, high details, beauty, 8K, octane light and shadow, complicated details, super wide angle, panoramic shooting, 8k. High definition.Volumetric light --ar 9:16 --upbeta  ",,
"This is a surreal and exquisite CG rendering. Night, the light blue of the sky, covering the beach glaciers, purple crystal heart stone, light path, feathers, moon, stars, art, high resolution, the starry sky, many small colorful light particles, is the Milky Way, the arctic, tundra and tip to illuminate, fantasy, high detail, beautiful, 8 k, tane light shadow, complex details of ultra wide Angle, panoramic camera, 8 k. High definition,HD --ar 9:16",,
"concept design, a white death rite bird with magic ghost flames in a colossal scale flying above Styx River under portal to galaxy with clear water reflections under night sky + aerial view of Roman relics and gothic cathedrals under light clouds, dynamix water waves, magic mist and haze over the river, hypermaximalist, soft lighting, low contrast + low exposure, elden ring + final fantasy, concept art, matte painting by James jean, Brian froud + ross tran + peter mohrbacher + alphonse mucha + john William Waterhouse, surreal, Greek Mythos, ethereal+ hyper realistic + epic + magic, 4k octane render, unreal engine, golden ratio, 12k, artstation trending, --ar 9:16 --test --upbeta",,
"winter fire and outdoors view of lakes and islands in snow, lean-to with a campfire and people —ar 2:3  --upbeta        --test --upbeta",,
"Lakes surrounded by woods at night, galaxies in the sky reflected in the water, golden clouds, golden sunset, illusory engines, ultra-realistic, intricate details and rich color dreams, sky covered with golden clouds, super wide-angle light, illusory engines, big moon, dreams, super wide-angle light, illusory engines, dreamy, super wide-angle light , Unreal Engine, 4K HD, , HD. --ar 9:16 --v 3",,
