,,
"Crossing HD CG, Purple Butterfly in Fire, Self-luminous Pink Broken Rose Cloud, Blue Sky Lightning, Light Effect, 8K, Ultra HD, Blizzard-style Art Trend, Luminous Fog Luminous Light, HD --ar 8:16 --testp --upbeta",,
"Silver starry sky, lake water, calm, sunset afterglow, colorful clouds, real shot, real, realistic, 8K, super wide angle, view, 3D, ultra high definition, high pixel,HD --ar 9:16",,
"This is a surreal and complex CG rendering. At night, the light blue sky as transparent as a mirror, crescent water, moonlight, starlight, trees, shining Milky Way, art, HD, starry sky, glaciers, many huge blue rose glacier, surreal blue rose, and many small and colorful luminous particles, dream, HD complex details, beauty, 4K, aurora, octane light and shadows, complex details, ultra wide angle, panoramic photography. Virtual engine, volume lights, reflected light, light effects.three-dimensional.16KHD --ar 9:16",,
"a lake at night surrounded by the woods, galaxies in the sky reflecting in the water, unreal engine, ultra realistic, intricately detailed, colorful --ar 9:16 ",,
"The picture is transparent, a large silvery white crescent is sprinkled on the sand accompanied by the Milky Way stars, there are many pink and blue roses floating on the sand, pink and blue roses floating on the sea, a beach in the shape of a heart, glowing creatures, Silver, Unreal Engine, Ultra Wide, 4K HD, HD. --ar 9:16 ",,
"Night, the Milky Way, starlight, the silvery white crescent moon is accompanied by the Milky Way starlight sprinkled on the beach, there are many glowing creatures in the beach, the beach is the shape of love, pebbles, glowing creatures, fluorescent, golden, color, dreamy, super wide-angle light , Unreal Engine, 4K HD, , HD. --ar 9:16 ",,
